{
  "$schema": "https://json-schema.org/draft/2020-12/schema",
  "$id": "https://harness-project/.gen/manifest/manifest.schema.json",
  "title": "GenerationManifest",
  "type": "object",
  "additionalProperties": false,
  "required": [
    "schemaVersion",
    "specHash",
    "designContextHash",
    "generatorVersion",
    "templateVersion",
    "modelVersion",
    "promptVersion",
    "designMcpVersion",
    "componentMapVersion",
    "lockfileHash",
    "outputs",
    "outputsHash",
    "evalReportRefs",
    "skills"
  ],
  "properties": {
    "schemaVersion": { "type": "string", "minLength": 1 },
    "specHash": { "type": "string", "minLength": 8 },
    "designContextHash": { "type": "string", "minLength": 8 },
    "generatorVersion": { "type": "string", "minLength": 1 },
    "templateVersion": { "type": "string", "minLength": 1 },
    "modelVersion": { "type": "string", "minLength": 1 },
    "promptVersion": { "type": "string", "minLength": 1 },
    "designMcpVersion": { "type": "string", "minLength": 1 },
    "componentMapVersion": { "type": "string", "minLength": 1 },
    "lockfileHash": { "type": "string", "minLength": 8 },
    "outputs": {
      "type": "array",
      "minItems": 1,
      "items": { "type": "string", "minLength": 1 }
    },
    "outputsHash": { "type": "string", "minLength": 8 },
    "evalReportRefs": {
      "type": "array",
      "minItems": 1,
      "items": { "type": "string", "minLength": 1 }
    },
    "skills": {
      "type": "array",
      "minItems": 1,
      "items": {
        "type": "object",
        "additionalProperties": false,
        "required": ["name", "version", "schemaVersion"],
        "properties": {
          "name": { "type": "string", "minLength": 1 },
          "version": { "type": "string", "minLength": 1 },
          "schemaVersion": { "type": "string", "minLength": 1 }
        }
      }
    }
  }
}
